<?xml version="1.0" encoding="utf-8" ?>
<gems xmlns:xsi="http://www.w3.org/2001/XMLSchema-instance"
      xmlns="http://epam.zlatamigas.xmltask/gems"
      xsi:schemaLocation="http://epam.zlatamigas.xmltask/gems ../schema/gem.xsd">

    <precious id="A-000001">
        <origin>South America</origin>
        <extraction-time>2002-01</extraction-time>
        <color>red</color>
        <transparency>12</transparency>
        <faces>2</faces>
        <mass>3</mass>
        <type>ruby</type>
    </precious>
    <precious name="Esmeralda" id="A-000002">
        <origin>North America</origin>
        <extraction-time>2022-02</extraction-time>
        <color>green</color>
        <transparency>90</transparency>
        <faces>8</faces>
        <mass>12.2</mass>
        <type>emerald</type>
    </precious>
    <semi-precious id="B-000001" name="Quartz">
        <origin>Asia</origin>
        <extraction-time>2017-03</extraction-time>
        <color>rose</color>
        <transparency>45</transparency>
        <faces>19</faces>
        <mass>23</mass>
    </semi-precious>
    <semi-precious id="B-000002" name="Quartz">
        <origin>Asia</origin>
        <extraction-time>2017-03</extraction-time>
        <color>rose</color>
        <transparency>45</transparency>
        <faces>19</faces>
        <mass>24</mass>
    </semi-precious>
    <semi-precious id="B-000003" name="Quartz">
        <origin>Asia</origin>
        <extraction-time>2017-03</extraction-time>
        <color>rose</color>
        <transparency>45</transparency>
        <faces>19</faces>
        <mass>19</mass>
    </semi-precious>
    <semi-precious id="B-000004" name="Quartz">
        <origin>Asia</origin>
        <extraction-time>2017-03</extraction-time>
        <color>rose</color>
        <transparency>45</transparency>
        <faces>19</faces>
        <mass>19</mass>
    </semi-precious>
    <precious id="A-000003">
        <origin>South America</origin>
        <extraction-time>2002-01</extraction-time>
        <color>red</color>
        <transparency>12</transparency>
        <faces>2</faces>
        <mass>3</mass>
        <type>ruby</type>
    </precious>
    <precious id="A-000004">
        <origin>South America</origin>
        <extraction-time>2002-01</extraction-time>
        <color>red</color>
        <transparency>12</transparency>
        <faces>2</faces>
        <mass>3</mass>
        <type>ruby</type>
    </precious>
    <precious id="A-000005">
        <origin>South America</origin>
        <extraction-time>2002-01</extraction-time>
        <color>red</color>
        <transparency>12</transparency>
        <faces>2</faces>
        <mass>3</mass>
        <type>ruby</type>
    </precious>
    <precious id="A-000006">
        <origin>North America</origin>
        <extraction-time>2002-01</extraction-time>
        <color>white</color>
        <transparency>90</transparency>
        <faces>9</faces>
        <mass>3</mass>
        <type>diamond</type>
    </precious>
    <semi-precious id="B-000005" name="Quartz">
        <origin>Asia</origin>
        <extraction-time>2017-03</extraction-time>
        <color>rose</color>
        <transparency>45</transparency>
        <faces>19</faces>
        <mass>23</mass>
    </semi-precious>
    <semi-precious id="B-000006" name="Quartz">
        <origin>Oceania</origin>
        <extraction-time>2017-03</extraction-time>
        <color>rose</color>
        <transparency>45</transparency>
        <faces>19</faces>
        <mass>24.9</mass>
    </semi-precious>
    <semi-precious name="Quartz" id="B-000007">
        <origin>Asia</origin>
        <extraction-time>2017-03</extraction-time>
        <color>rose</color>
        <transparency>45</transparency>
        <faces>19</faces>
        <mass>19</mass>
    </semi-precious>
    <semi-precious id="B-000008">
        <origin>Asia</origin>
        <extraction-time>2017-03</extraction-time>
        <color>rose</color>
        <transparency>45</transparency>
        <faces>19</faces>
        <mass>19</mass>
    </semi-precious>
    <precious id="A-000007">
        <origin>South America</origin>
        <extraction-time>2002-01</extraction-time>
        <color>red</color>
        <transparency>12</transparency>
        <faces>2</faces>
        <mass>3</mass>
        <type>ruby</type>
    </precious>
    <precious id="A-000008">
        <origin>Europe</origin>
        <extraction-time>2012-12</extraction-time>
        <color>black</color>
        <transparency>90</transparency>
        <faces>9</faces>
        <mass>3</mass>
        <type>sapphire</type>
    </precious>
</gems>